smartctl 7.2 2020-12-30 r5155 [x86_64-linux-5.15.0-113-generic] (local build)
Copyright (C) 2002-20, Bruce Allen, Christian Franke, www.smartmontools.org

=== START OF SMART DATA SECTION ===
SMART/Health Information (NVMe Log 0x02)
Critical Warning:                   0x00
Temperature:                        30 Celsius
Available Spare:                    100%
Available Spare Threshold:          10%
Percentage Used:                    1%
Data Units Read:                    21.270.390 [10,8 TB]
Data Units Written:                 11.781.471 [6,03 TB]
Host Read Commands:                 200.348.571
Host Write Commands:                163.041.781
Controller Busy Time:               926
Power Cycles:                       994
Power On Hours:                     847
Unsafe Shutdowns:                   31
Media and Data Integrity Errors:    0
Error Information Log Entries:      1.692
Warning  Comp. Temperature Time:    0
Critical Comp. Temperature Time:    0
Temperature Sensor 1:               30 Celsius
Temperature Sensor 2:               33 Celsius

