smartctl 7.2 2020-12-30 r5155 [x86_64-linux-6.5.0-1024-oem] (local build)
Copyright (C) 2002-20, Bruce Allen, Christian Franke, www.smartmontools.org

=== START OF SMART DATA SECTION ===
SMART/Health Information (NVMe Log 0x02)
Critical Warning:                   0x00
Temperature:                        48 Celsius
Available Spare:                    100%
Available Spare Threshold:          50%
Percentage Used:                    0%
Data Units Read:                    11.206.313 [5,73 TB]
Data Units Written:                 7.822.626 [4,00 TB]
Host Read Commands:                 137.555.387
Host Write Commands:                135.694.207
Controller Busy Time:               28.819
Power Cycles:                       1.020
Power On Hours:                     1.589
Unsafe Shutdowns:                   110
Media and Data Integrity Errors:    0
Error Information Log Entries:      0
Warning  Comp. Temperature Time:    0
Critical Comp. Temperature Time:    0
Temperature Sensor 1:               43 Celsius
Temperature Sensor 2:               46 Celsius

