=== START OF INFORMATION SECTION ===
Model Family:     Western Digital Green
Device Model:     WDC WD40EZRX-00SPEB0
Serial Number:    WD-WCC4E0299655
LU WWN Device Id: 5 0014ee 209251107
Firmware Version: 80.00A80
User Capacity:    4.000.753.476.096 bytes [4,00 TB]
Sector Sizes:     512 bytes logical, 4096 bytes physical
Rotation Rate:    5400 rpm
Device is:        In smartctl database [for details use: -P show]
ATA Version is:   ACS-2 (minor revision not indicated)
SATA Version is:  SATA 3.0, 6.0 Gb/s (current: 3.0 Gb/s)
Local Time is:    Sun Jul  7 22:44:58 2024 CEST
SMART support is: Available - device has SMART capability.
SMART support is: Enabled

=== START OF READ SMART DATA SECTION ===
SMART overall-health self-assessment test result: FAILED!
Drive failure expected in less than 24 hours. SAVE ALL DATA.
Failed Attributes:
ID# ATTRIBUTE_NAME          FLAG     VALUE WORST THRESH TYPE      UPDATED  WHEN_FAILED RAW_VALUE
  1 Raw_Read_Error_Rate     0x002f   001   001   051    Pre-fail  Always   FAILING_NOW 743726

=== START OF READ SMART DATA SECTION ===
SMART Attributes Data Structure revision number: 16
Vendor Specific SMART Attributes with Thresholds:
ID# ATTRIBUTE_NAME          FLAG     VALUE WORST THRESH TYPE      UPDATED  WHEN_FAILED RAW_VALUE
  1 Raw_Read_Error_Rate     0x002f   001   001   051    Pre-fail  Always   FAILING_NOW 743726
  3 Spin_Up_Time            0x0027   173   168   021    Pre-fail  Always       -       8341
  4 Start_Stop_Count        0x0032   100   100   000    Old_age   Always       -       667
  5 Reallocated_Sector_Ct   0x0033   190   190   140    Pre-fail  Always       -       296
  7 Seek_Error_Rate         0x002e   200   200   000    Old_age   Always       -       0
  9 Power_On_Hours          0x0032   099   099   000    Old_age   Always       -       1126
 10 Spin_Retry_Count        0x0032   100   100   000    Old_age   Always       -       0
 11 Calibration_Retry_Count 0x0032   100   100   000    Old_age   Always       -       0
 12 Power_Cycle_Count       0x0032   100   100   000    Old_age   Always       -       643
192 Power-Off_Retract_Count 0x0032   200   200   000    Old_age   Always       -       395
193 Load_Cycle_Count        0x0032   191   191   000    Old_age   Always       -       28513
194 Temperature_Celsius     0x0022   125   104   000    Old_age   Always       -       27
196 Reallocated_Event_Count 0x0032   168   168   000    Old_age   Always       -       32
197 Current_Pending_Sector  0x0032   200   200   000    Old_age   Always       -       0
198 Offline_Uncorrectable   0x0030   200   200   000    Old_age   Offline      -       0
199 UDMA_CRC_Error_Count    0x0032   200   200   000    Old_age   Always       -       0
200 Multi_Zone_Error_Rate   0x0008   200   200   000    Old_age   Offline      -       0

〜〜〜〜〜〜〜〜〜〜〜〜〜〜〜〜〜〜〜〜〜〜〜〜〜〜〜〜〜〜〜〜〜〜〜

